CNPJ,CNAE_PRINCIPAL,DESC_PRINCIPAL,CNAE_SEC_1,DESC_SEC_1,CNAE_SEC_2,DESC_SEC_2,STATUS
16928871000614,4771702.0,"Comércio varejista de produtos farmacêuticos, com manipulação de fórmulas",4721104.0,"Comércio varejista de doces, balas, bombons e semelhantes",4723700.0,Comércio varejista de bebidas,OK
61653637000171,7020400.0,"Atividades de consultoria em gestão empresarial, exceto consultoria técnica específica",8299799.0,Outras atividades de serviços prestados principalmente às empresas não especificadas anteriormente,,,OK
04905427000190,9511800.0,Reparação e manutenção de computadores e de equipamentos periféricos,3314709.0,"Manutenção e reparação de máquinas de escrever, calcular e de outros equipamentos não-eletrônicos para escritório",6209100.0,"Suporte técnico, manutenção e outros serviços em tecnologia da informação",OK
30957998000188,8599604.0,Treinamento em desenvolvimento profissional e gerencial,6201502.0,Web design,7020400.0,"Atividades de consultoria em gestão empresarial, exceto consultoria técnica específica",OK
01563351000173,4661300.0,"Comércio atacadista de máquinas, aparelhos e equipamentos para uso agropecuário; partes e peças",3314712.0,Manutenção e reparação de tratores agrícolas,3314717.0,"Manutenção e reparação de máquinas e equipamentos de terraplenagem, pavimentação e construção, exceto tratores",OK
